title,pmid,url,abstract
Tumor-educated B cells selectively promote breast cancer lymph node metastasis by HSPA4-targeting IgG,30643287,https://pubmed.ncbi.nlm.nih.gov/30643287,"Primary tumors may create the premetastatic niche in secondary organs for subsequent metastasis. Humoral immunity contributes to the progression of certain cancers, but the roles of B cells and their derived antibodies in premetastatic niche formation are poorly defined. Using a mouse model of spontaneous lymph node metastasis of breast cancer, we show that primary tumors induced B cell accumulation in draining lymph nodes. These B cells selectively promoted lymph node metastasis by producing pathogenic IgG that targeted glycosylated membrane protein HSPA4, and activated the HSPA4-binding protein ITGB5 and the downstream Src/NF-κB pathway in tumor cells for CXCR4/SDF1α-axis-mediated metastasis. High serum anti-HSPA4 IgG was correlated with high tumor HSPA4 expression and poor prognosis of breast cancer subjects. Our findings identify a key role for tumor-educated B cells and their derived antibodies in lymph node premetastatic niche formation, providing potential targets for cancer intervention."
HSPA4 upregulation induces immune evasion via ALKBH5/CD58 axis in gastric cancer,38589927,https://pubmed.ncbi.nlm.nih.gov/38589927,"Introduction:
        

      
      Gastric cancer (GC) is one of the leading causes of cancer-related death worldwide. Recently, targeted therapies including PD1 (programmed cell death 1) antibodies have been used in advanced GC patients. However, identifying new biomarker for immunotherapy is still urgently needed. The objective of this study is to unveil the immune evasion mechanism of GC cells and identify new biomarkers for immune checkpoint blockade therapy in patients with GC.
    





          Methods:
        

      
      Coimmunoprecipitation and meRIP were performed to investigate the mechanism of immune evasion of GC cells. Cocuture system was established to evaluate the cytotoxicity of cocultured CD8
+
 T cells. The clinical significance of HSPA4 upregulation was analyzed by multiplex fluorescent immunohistochemistry staining in GC tumor tissues.
    





          Results:
        

      
      Histone acetylation causes HSPA4 upregulation in GC tumor tissues. HSPA4 upregulation increases the protein stability of m
6
A demethylase ALKBH5. ALKBH5 decreases CD58 in GC cells through m
6
A methylation regulation. The cytotoxicity of CD8
+
 T cells are impaired and PD1/PDL1 axis is activated when CD8
+
 T cells are cocultured with HSPA4 overexpressed GC cells. HSPA4 upregulation is associated with worse 5-year overall survival of GC patients receiving only surgery. It is an independent prognosis factor for worse survival of GC patients. In GC patients receiving the combined chemotherapy with anti-PD1 immunotherapy, HSPA4 upregulation is observed in responders compared with non-responders.
    





          Conclusion:
        

      
      HSPA4 upregulation causes the decrease of CD58 in GC cells via HSPA4/ALKBH5/CD58 axis, followed by PD1/PDL1 activation and impairment of CD8
+
 T cell's cytotoxicity, finally induces immune evasion of GC cells. HSPA4 upregulation is associated with worse overall survival of GC patients with only surgery. Meanwhile, HSPA4 upregulation predicts for better response in GC patients receiving the combined immunotherapy."
HSPA4 Knockdown Retarded Progression and Development of Colorectal Cancer,34163243,https://pubmed.ncbi.nlm.nih.gov/34163243,"Purpose:
        

      
      Colorectal cancer (CRC) is a common malignancy associated with high morbidity and mortality. Heat shock 70 kDa protein 4 (HSPA4) has been shown to exert regulatory roles during tumor progression in different cancer types. Here, we investigated the expression and cellular functions of HSPA4 in CRC.
    





          Materials and methods:
        

      
      Expression of HSPA4 in CRC tissues and paracancerous tissues was analyzed by RT-qPCR and immunohistochemistry IHC staining. The functional roles of HSPA4 were explored using shRNA-mediated knockdown in HCT116 and RKO CRC cell lines, both in vitro and in tumor xenograft studies.
    





          Results:
        

      
      HSPA4 expression was significantly increased at the RNA and protein levels in CRC tissues compared with noncancerous tissues. Moreover, HSPA4 expression was positively associated with tumor stage and its high expression of HSPA4 indicated poor patient prognosis. In vitro studies established that HSPA4 knockdown inhibited proliferation and migration, causing arrest in the G2-phase of the cell cycle along with increased levels of apoptosis. This phenotype was recapitulated in vivo where HSPA4 knockdown suppressed xenograft growth. Mechanistic investigations showed silencing of HSPA4 reduced activation of the PI3K, Akt signaling axis while also downregulating the cell cycle progression markers, CCND1 and CDK6. Similarly, there was altered expression of apoptosis-related proteins consistent with the increase in apoptosis.
    





          Conclusion:
        

      
      Our findings demonstrate clinical significance for HSPA4 in CRC, further showing that HSPA4 contributes to CRC tumorigenesis through effects on proliferation, migration and survival. Thus, HSPA4 represents a novel prognostic indicator as well as a promising therapeutic target in CRC."
"HSPA4, the ""Evil Chaperone"" of the HSP Family, Delays Gastric Ulcer Healing",25732714,https://pubmed.ncbi.nlm.nih.gov/25732714,
Significant correlation between HSPA4 and prognosis and immune regulation in hepatocellular carcinoma,34754620,https://pubmed.ncbi.nlm.nih.gov/34754620,"Background:
        

      
      Hepatocellular carcinoma (HCC) is an inflammation-associated tumor involved in immune tolerance and evasion in the immune microenvironment. Heat shock proteins (HSPs) are involved in the occurrence, progression, and immune regulation of tumors. Therefore, HSPs have been considered potential therapeutic targets. Here, we aimed to elucidate the value of HSP family A (Hsp70) member 4 (HSPA4) in the diagnosis and predicting prognosis of HCC, and its relationship with immune cell infiltration, immune cell biomarkers, and immune checkpoints. Gene mutation, DNA methylation, and the pathway involved in HCC were also analyzed.
    





          Methods:
        

      
      The gene expression omnibus (GEO) and The Cancer Genome Atlas (TCGA) databases were used to compare HSPA4 expression, and the results were confirmed by immunohistochemical staining of clinical samples. R package was used to analyze the correlation between HSPA4 and cancer stage, and to establish receiver operating characteristic (ROC) curve of diagnosis, time-dependent survival ROC curve, and a nomogram model. cBioPortal and MethSurv were used to identify genetic alterations and DNA methylation, and their effect on prognosis. The Tumor Immune Estimation Resource (TIMER) was used to analyze immune cell infiltration, immune cell biomarkers, and immune checkpoints. The STRING database was used to analyze protein-protein interaction network information. Gene Ontology (GO) analysis and the Kyoto Encyclopedia of Genes and Genomes (KEGG) analyses were performed to investigate the functions of HSPA4 and its functional partner genes.
    





          Results:
        

      
      Overexpression of HSPA4 was identified in 25 cancers. Overexpression of HSPA4 considerably correlated with cancer stage and alpha-fetoprotein (AFP) level in HCC. Patients with higher HSPA4 expression showed poorer prognosis. HSPA4 expression can accurately identify tumor from normal tissue (AUC = 0.957). The area under 1-, 3-, and 5-year survival ROCs were above 0.6. The HSPA4 genetic alteration rate was 1.3%. Among the 14 DNA methylation CpG sites, seven were related to the prognosis of HCC. HSPA4 was positively related to immune cell infiltration and immune checkpoints (PD-1 and CTLA-4) in HCC. The KEGG pathway enrichment analysis revealed HSPA4 enrichment in antigen processing and presentation together with HSPA8 and HSP90AA1. We verified the value of HSPA4 in the diagnosis and predicting prognosis of HCC. HSPA4 may not only participate in the occurrence and progression but also the immune regulation of HCC. Therefore, HSPA4 can be a potential diagnostic and prognostic biomarker and a therapeutic target for HCC."
HSPA4 regulated glioma progression via activation of AKT signaling pathway,37339521,https://pubmed.ncbi.nlm.nih.gov/37339521,"Glioma is still an incurable disease with high invasiveness. Heat shock 70 kDa protein 4 (HSPA4) is a member of the HSP110 family, and is associated with the development and progression of various cancers. In the current study, we assessed the expression of HSPA4 in clinical samples, and found that HSPA4 was up-regulated in glioma tissues and correlated with tumor recurrence and grade. Survival analyses demonstrated that glioma patients with high HSPA4 expression had lower overall survival and disease-free survival times. In vitro knockdown of HSPA4 inhibited glioma cell proliferation, mediated cell cycle arrest at G2 phase and apoptosis, and reduced the migration ability. In vivo, the growth of HSPA4-knockdown xenografts was markedly suppressed compared to the tumors formed by HSPA4-positive control cells. Additionally, Gene set enrichment analyses disclosed that HSPA4 was associated with the PI3K/Akt signaling pathway. The regulatory effect of the AKT activator SC79 on cell proliferation and apoptosis was suppressed by HSPA4 knockdown, indicating that HSPA4 is capable of promoting glioma development. In summary, these data showed that HSPA4 is likely to play a pivotal role in the progression of glioma, and consequently may be a promising therapeutic target for glioma therapy."
HSPA4 Is a Biomarker of Placenta Accreta and Enhances the Angiogenesis Ability of Vessel Endothelial Cells,35628491,https://pubmed.ncbi.nlm.nih.gov/35628491,"Placenta accreta spectrum (PAS) accounts for 7% of maternal mortality and is associated with intraoperative and postoperative morbidity caused by massive blood loss, infection, and adjacent organ damage. The aims of this study were to identify the protein biomarkers of PAS and to further explore their pathogenetic roles in PAS. For this purpose, we collected five placentas from pregnant subjects with PAS complications and another five placentas from normal pregnancy (NP) cases. Then, we enriched protein samples by specifically isolating the trophoblast villous, deeply invading into the uterine muscle layer in the PAS patients. Next, fluorescence-based two-dimensional difference gel electrophoresis (2D-DIGE) and MALDI-TOF/MS were used to identify the proteins differentially abundant between PAS and NP placenta tissues. As a result, nineteen spots were determined as differentially abundant proteins, ten and nine of which were more abundant in PAS and NP placenta tissues, respectively. Then, specific validation with western blot assay and immunohisto/cytochemistry (IHC) assay confirmed that heat shock 70 kDa protein 4 (HSPA4) and chorionic somatomammotropin hormone (CSH) were PAS protein biomarkers. Further tube formation assays demonstrated that HSPA4 promoted the in vitro angiogenesis ability of vessel endothelial cells, which is consistent with the in vivo scenario of PAS complications. In this study, we not only identified PAS protein biomarkers but also connected the promoted angiogenesis with placenta invasion, investigating the pathogenetic mechanism of PAS."
SIRT1 attenuates neuroinflammation by deacetylating HSPA4 in a mouse model of Parkinson's disease,35158021,https://pubmed.ncbi.nlm.nih.gov/35158021,"As a deacetylase, SIRT1 plays essential roles in various physiological events, from development to lifespan regulation. SIRT1 has been shown neuroprotective effects in neurodegeneration disorders such as Parkinson's disease (PD). However, the underlying molecular mechanisms are still not well understood. Here, we generated transgenic mice with increased expression of Sirt1 in the brain and examined the potential roles of SIRT1 in PD. Our data showed that SIRT1 repressed proinflammatory cytokine expression both in microglia and astrocytes. In MPTP induced PD model mice, lower levels of microglia and astrocyte activation were observed in SIRT1 transgenic mice. Moreover, the tyrosine hydroxylase (TH) loss in the substantia nigra pars compacta (SNpc) and striatum induced by MPTP was also attenuated by SIRT1. As a consequence, the behavioral defects induced by MPTP were largely prevented in SIRT1 transgenic mice. Mechanistically, SIRT1 interacts with heat shock 70 kDa protein 4 (HSPA4) and deacetylates it at 305, 351 and 605 lysine residues. This deacetylation modification induces the nuclear translocation of HSPA4 and thus to repress proinflammatory cytokine expression. On the contrary, mutated HSPA4, in which 305/351/605 lysine residues were replaced with arginine, was mainly localized in the cytoplasm and losses its repression on proinflammatory cytokine expression. Taken together, our data indicate that SIRT1 plays beneficial roles in PD model mice, which is likely due to, at least in part, its anti-inflammation activity in glial cells by deacetylating HSPA4. Furthermore, HSPA4 might be a druggable target for developing novel agents for treating neuroinflammation associated disorders such as PD."
Respiratory distress and early neonatal lethality in Hspa4l/Hspa4 double-mutant mice,23980576,https://pubmed.ncbi.nlm.nih.gov/23980576,"Heat shock proteins HSPA4L and HSPA4 are closely related members of the HSP110 family and act as cochaperones. We generated Hspa4l(-/-)Hspa4(-/-) mice to investigate a functional complementarity between HSPA4L and HSPA4 during embryonic development. Hspa4l(-/-)Hspa4(-/-) embryos exhibited marked pulmonary hypoplasia and neonatal death. Compared with lungs of wild-type, Hspa4l(-/-), and Hspa4(-/-) embryos, Hspa4l(-/-)Hspa4(-/-) lungs were characterized by diminished saccular spaces and increased mesenchymal septa. Mesenchymal hypercellularity was determined to be due to an increased cell proliferation index and decreased cell death. A significant increase in expression levels of prosurvival protein B cell leukemia/lymphoma 2 may be the cause for inhibition of apoptotic process in lungs of Hspa4(-/-)Hspa4l(-/-) embryos. Accumulation of glycogen and diminished expression of surfactant protein B, prosurfactant protein C, and aquaporin 5 in saccular epithelium suggested impaired maturation of type II and type I pneumocytes in the Hspa4l(-/-)Hspa4(-/-) lungs. Further experiments showed a significant accumulation of ubiquitinated proteins in the lungs of Hspa4l(-/-)Hspa4(-/-) embryos, indicating an impaired chaperone activity. Our study demonstrates that HSPA4L and HSPA4 collaborate in embryonic lung maturation, which is necessary for adaptation to air breathing at birth."
Heat-shock protein HSPA4 is required for progression of spermatogenesis,21487003,https://pubmed.ncbi.nlm.nih.gov/21487003,"Heat-shock protein 110 (HSP110) family members act as nucleotide exchange factors (NEF) of mammalian and yeast HSP70 chaperones during the ATP hydrolysis cycle. In this study, we describe the expression pattern of murine HSPA4, a member of the HSP110 family, during testis development and the consequence of HSPA4 deficiency on male fertility. HSPA4 is ubiquitously expressed in all the examined tissues. During prenatal and postnatal development of gonad, HSPA4 is expressed in both somatic and germ cells; however, expression was much higher in germ cells of prenatal gonads. Analyses of Hspa4-deficient mice revealed that all homozygous mice on the hybrid C57BL/6J×129/Sv genetic background were apparently healthy. Although HSPA4 is expressed as early as E13.5 in male gonad, a lack of histological differences between Hspa4(-/-) and control littermates suggests that Hspa4 deficiency does not impair the gonocytes or their development to spermatogonia. Remarkably, an increased number of the Hspa4-deficient males displayed impaired fertility, whereas females were fertile. The total number of spermatozoa and their motility were drastically reduced in infertile Hspa4-deficient mice compared with wild-type littermates. The majority of pachytene spermatocytes in the juvenile Hspa4(-/-) mice failed to complete the first meiotic prophase and became apoptotic. Furthermore, down-regulation of transcription levels of genes known to be expressed in spermatocytes at late stages of prophase I and post-meiotic spermatids leads to suggest that the development of most spermatogenic cells is arrested at late stages of meiotic prophase I. These results provide evidence that HSPA4 is required for normal spermatogenesis."
Targeted disruption of Hspa4 gene leads to cardiac hypertrophy and fibrosis,22884543,https://pubmed.ncbi.nlm.nih.gov/22884543,"Failure of molecular chaperones to direct the correct folding of newly synthesized proteins leads to the accumulation of misfolded proteins in cells. HSPA4 is a member of the heat shock protein 110 family (HSP110) that acts as a nucleotide exchange factor of HSP70 chaperones. We found that the expression of HSPA4 is upregulated in murine hearts subjected to pressure overload and in failing human hearts. To investigate the cardiac function of HSPA4, Hspa4 knockout (KO) mice were generated and exhibited cardiac hypertrophy and fibrosis. Hspa4 KO hearts were characterized by a significant increase in heart weight/body weight ratio, elevated expression of hypertrophic and fibrotic gene markers, and concentric hypertrophy with preserved contractile function. In response to pressure overload, cardiac hypertrophy and remodeling were further aggravated in the Hspa4 KO compared to wild type (WT) mice. Cardiac hypertrophy in Hspa4 KO hearts was associated with enhanced activation of gp130-STAT3, CaMKII, and calcineurin-NFAT signaling. Protein blot and immunofluorescent analyses showed a significant accumulation of polyubiquitinated proteins in cardiac cells of Hspa4 KO mice. These results suggest that the myocardial remodeling of Hspa4 KO mice is due to accumulation of misfolded proteins resulting from impaired chaperone activity. Further analyses revealed a significant increase in cross sectional area of cardiomyocytes, and in expression levels of hypertrophic markers in cultured neonatal Hspa4 KO cardiomyocytes suggesting that the hypertrophy of mutant mice was a result of primary defects in cardiomyocytes. Gene expression profile in hearts of 3.5-week-old mice revealed a differentially expressed gene sets related to ion channels, muscle-specific contractile proteins and stress response. Taken together, our in vivo data demonstrate that Hspa4 gene ablation results in cardiac hypertrophy and fibrosis, possibly, through its role in protein quality control mechanism."
Hspa4 (HSP70) is involved in the radioadaptive response: results from mouse splenocytes,12005543,https://pubmed.ncbi.nlm.nih.gov/12005543,"In a continuation of our earlier study on the involvement of HSP25 (now known as Hspb1) and HSP70 (now known as Hspa4) in the induction of an adaptive response, we examined the involvement of these proteins in the induction of the adaptive response using an animal model system. C57BL6 mice were irradiated with 5 cGy of gamma radiation three times in 1 week (for a total of 15 cGy), and a high challenge dose (6 Gy) was given on the day after the last low-dose irradiation. The survival time of the low-dose preirradiated mice was increased to 30%. The induction of apoptosis induced by 6 Gy was also reduced by this low-dose preirradiation regimen. To elucidate any link existing between the HSPs and the induction of the adaptive response, reverse transcriptase (RT)-polymerase chain reaction (PCR) analysis was performed using splenocytes. High-dose radiation up-regulated the expression of Hspb1 and especially Hspa4, while expression of other HSPs such as HSC70 (now know as Hspa8), Hsp90, and alphaB-crystalline (now known as Cryab) did not change. When splenocytes from Hspa4 transgenic mice were preirradiated with a low dose of radiation, a reduction in cell death after high-dose irradiation was observed. These results suggest that Hspa4 is a key molecule in the induction of the adaptive response."
Frameshift Mutations of HSPA4 and MED13 in Gastric and Colorectal Cancers,27129500,https://pubmed.ncbi.nlm.nih.gov/27129500,"Frameshift mutation of genes containing mononucleotide repeats is a feature of gastric (GC) and colorectal cancers (CRC) with microsatellite instability (MSI). In the public genome database, we found that human HSPA4 gene encoding a heats hock protein 70 protein (HSP70-4) and MED13 gene had mononucleotide repeats in the coding sequences that could be targets for frameshift mutation in cancers with MSI. HSP70-4 is a member of HSP70 that is known to play a role in cell survival. MED13 is a member of MED genome-wide transcription regulators that function as a regulator for diverse biological processes. In this study, we analyzed the mutations in 79 GCs and 124 CRCs including high MSI (MSI-H) and microsatellite stable/low MSI (MSS/MSI-L) cases by single-strand conformation polymorphism analysis and DNA sequencing. We found frameshift mutations of HSPA4 gene in two cancers (one GC and one CRC) and MED13 gene in the other two cancers (one GC and one CRC). The frameshift mutations were deletions of one base (c.2396delA (p.Asn799MetfsX50)) in HSPA4 and (c.2175delA (p.Lys725AsnfsX4)) in MED13. Each of HSPA4 and MED13 mutations were detected in GC with MSI-H (1/34: 2.9 %) and CRC with MSI-H (1/79: 1.3 %), but not in those with MSS. Our data show that unconventional HSPA4 and MED13 genes harbored frameshift mutations in GC and CRC with MSI. These mutations might possibly inactivate their functions and could be a feature of GC and CRC with MSI-H."
Retracted: Inhibition of DNAJC12 Inhibited Tumorigenesis of Rectal Cancer via Downregulating HSPA4 Expression,37565223,https://pubmed.ncbi.nlm.nih.gov/37565223,[This retracts the article DOI: 10.1155/2022/1027895.].
Inhibition of DNAJC12 Inhibited Tumorigenesis of Rectal Cancer via Downregulating HSPA4 Expression,36185081,https://pubmed.ncbi.nlm.nih.gov/36185081,"Background:
        

      
      Dysregulation of DnaJ heat shock protein family (HSP40) member C12 (DNAJC12) is implicated in the malignancy progression of multiple cancers. The current study aimed to determine the biology function and mechanism of DNAJC12 in rectal cancer (RC).
    





          Methods:
        

      
      RC tissues, adjacent tissues, RC cell lines, and normal colorectal epithelial cell lines were collected to analyze DNAJC12 expression. The abilities of DNAJC12 on proliferation, migration, and apoptosis of RC cells were detected by CCK-8, wound healing, and flow cytometry assays. Co-IP assays were carried out to confirm the association between DNAJC12 and HSPA4. The effect of DNAJC12 on tumor growth was detected by using the xenograft model of nude mice.
    





          Results:
        

      
      Elevation of DNAJC12 was uncovered in RC tissues and cell lines. DNAJC12 upregulation facilitated RC cell proliferation and migration and induced apoptosis, while DNAJC12 interference showed the opposite results. Besides, HSAP4 served as a potential binding protein for DNAJC12. Rescue experiments revealed that elevated of HSAP4 restored the impact of DNAJC12 silencing on the cell functions. Finally, DNAJC12 silencing hampered tumor growth of RC in vivo.
    





          Conclusion:
        

      
      In summary, this study highlighted a key player of DNAJC12 in modulating the malignant biological progression of RC via DNAJC12/HSPA4 axis, displaying a potential therapeutic target for RC."
"Unveiling the potential of HSPA4: a comprehensive pan-cancer analysis of HSPA4 in diagnosis, prognosis, and immunotherapy",38305786,https://pubmed.ncbi.nlm.nih.gov/38305786,"With the global rise in cancer incidence and mortality rates, research on the topic has become increasingly urgent. Among the significant players in this field are heat shock proteins (HSPs), particularly HSPA4 from the HSP70 subfamily, which has recently garnered considerable interest for its role in cancer progression. However, despite numerous studies on HSPA4 in specific cancer types, a comprehensive analysis across all cancer types is lacking. This study employs various bioinformatics techniques to delve into the role of HSPA4 in pan-cancer. Our objective is to assess its potential in clinical diagnosis, prognosis, and as a future molecular target for therapy. The research findings reveal significant differences in HSPA4 expression across different cancer types, suggesting its diagnostic value and close association with cancer staging and patient survival rates. Furthermore, genetic variations and methylation status of HSPA4 play critical roles in tumorigenesis. Lastly, the interaction of HSPA4 with immune cells is linked to the tumor microenvironment (TME) and immunotherapy. In summary, HSPA4 emerges as a promising cancer biomarker and a vital member of the HSPs family, holding potential applications in diagnosis, prognosis, and immunotherapy."
